{
  "schema_version": 1,
  "project_id": "pulsepatch-demo",
  "confidentiality": "restricted",
  "attachments": [
    {"source":"example-design-brief.pdf","media_type":"application/pdf","authorized":true,"notes":"Fictional example attachment used only to demonstrate the workflow."}
  ],
  "facts": {
    "project_name": {"value":"PulsePatch","status":"supported","confidence":"high","evidence":[{"source":"example-design-brief.pdf","locator":"p.1 title","evidence_type":"direct"}],"user_confirmation_required":false},
    "positioning": {"value":"A reusable wearable that guides desk workers through short, discreet posture-reset exercises.","status":"supported","confidence":"high","evidence":[{"source":"example-design-brief.pdf","locator":"p.1 project summary","evidence_type":"direct"}],"user_confirmation_required":false},
    "target_user": {"value":"Desk workers who experience recurring neck and shoulder discomfort during long computer sessions.","status":"supported","confidence":"high","evidence":[{"source":"example-design-brief.pdf","locator":"p.2 target users","evidence_type":"direct"}],"user_confirmation_required":false},
    "problem": {"value":"Existing posture reminders are easy to ignore and often interrupt focused work without showing a corrective action.","status":"supported","confidence":"high","evidence":[{"source":"example-design-brief.pdf","locator":"p.2 problem statement","evidence_type":"direct"}],"user_confirmation_required":false},
    "solution": {"value":"PulsePatch senses sustained upper-back posture and delivers a gentle directional vibration that cues a 30-second reset movement.","status":"supported","confidence":"high","evidence":[{"source":"example-design-brief.pdf","locator":"p.3 solution","evidence_type":"direct"}],"user_confirmation_required":false},
    "core_functions": {"value":["Detect sustained posture patterns","Deliver directional haptic exercise cues","Record completed reset sessions locally"],"status":"supported","confidence":"high","evidence":[{"source":"example-design-brief.pdf","locator":"p.3 functions","evidence_type":"direct"}],"user_confirmation_required":false},
    "key_features": {"value":["Two-point haptic cue","Washable textile carrier","No-camera local sensing"],"status":"supported","confidence":"high","evidence":[{"source":"example-design-brief.pdf","locator":"p.3 features","evidence_type":"direct"}],"user_confirmation_required":false},
    "innovation_points": {"value":["Directional haptics turn a passive alert into an immediately actionable movement cue","A removable electronics pod allows the textile carrier to be washed and reused"],"status":"supported","confidence":"high","evidence":[{"source":"example-design-brief.pdf","locator":"p.4 design rationale","evidence_type":"direct"}],"user_confirmation_required":false},
    "competitive_difference": {"value":"Unlike screen notifications or camera-based trackers, PulsePatch gives private on-body guidance and processes motion data on the device.","status":"supported","confidence":"high","evidence":[{"source":"example-design-brief.pdf","locator":"p.4 comparison","evidence_type":"direct"}],"user_confirmation_required":false},
    "user_benefit": {"value":"Users receive a specific corrective cue without leaving the current task or enabling a camera.","status":"supported","confidence":"high","evidence":[{"source":"example-design-brief.pdf","locator":"p.5 user value","evidence_type":"direct"}],"user_confirmation_required":false},
    "client_brand_benefit": {"value":"The modular architecture gives the client a serviceable wearable platform with replaceable textile parts instead of a sealed single-use product.","status":"supported","confidence":"high","evidence":[{"source":"example-design-brief.pdf","locator":"p.5 client value","evidence_type":"direct"}],"user_confirmation_required":false},
    "social_impact": {"value":"The design makes preventive movement guidance accessible during ordinary desk work without recording video of the user or workplace.","status":"supported","confidence":"high","evidence":[{"source":"example-design-brief.pdf","locator":"p.5 impact","evidence_type":"direct"}],"user_confirmation_required":false},
    "sustainability": {"value":"The washable carrier and replaceable battery-and-sensor pod separate high-wear textile parts from longer-life electronics.","status":"supported","confidence":"high","evidence":[{"source":"example-design-brief.pdf","locator":"p.6 lifecycle","evidence_type":"direct"}],"user_confirmation_required":false},
    "aesthetics_form": {"value":"A low-profile curved pod follows the upper back, while the seamless grey textile carrier is visually quiet under everyday clothing.","status":"supported","confidence":"high","evidence":[{"source":"example-design-brief.pdf","locator":"p.6 form and appearance","evidence_type":"direct"}],"user_confirmation_required":false},
    "cmf": {"value":"Matte recycled-polycarbonate pod, neutral grey knitted carrier, and soft silicone skin-contact pads.","status":"supported","confidence":"high","evidence":[{"source":"example-design-brief.pdf","locator":"p.6 CMF","evidence_type":"direct"}],"user_confirmation_required":false},
    "materials": {"value":["Recycled polycarbonate","Nylon-elastane knit","Medical-grade silicone"],"status":"supported","confidence":"high","evidence":[{"source":"example-design-brief.pdf","locator":"p.6 materials","evidence_type":"direct"}],"user_confirmation_required":false},
    "retail_price": {"value":"Target retail price: USD 129 (pre-launch estimate)","status":"supported","confidence":"high","evidence":[{"source":"example-design-brief.pdf","locator":"p.7 commercial assumptions","evidence_type":"direct"}],"user_confirmation_required":false},
    "physical_dimensions": {"value":"Electronics pod: 72 × 38 × 9 mm; textile carrier: 180 × 95 mm","status":"supported","confidence":"high","evidence":[{"source":"example-design-brief.pdf","locator":"p.7 dimensions","evidence_type":"direct"}],"user_confirmation_required":false}
  }
}
